{
  "$schema": "../year.schema.json",
  "year": 2023,
  "source": "2023 Annual Audit Report (Commission on Audit), Statement of Comparison of Budget and Actual Amounts",
  "sourceFile": "09-PanaboCity2023_Part1-FS.xlsx",
  "totals": {
    "revenue": {"original": 2284410751.51, "final": 2569666800.77, "actual": 2568572915.4},
    "currentAppropriations": {"original": 1488790026.81, "final": 1856173663.77, "actual": 1280058362.93},
    "continuingAppropriations": {"original": 749277959.17, "final": 641982025.75, "actual": 357945524.1},
    "totalAppropriations": {"original": 2238067985.98, "final": 2498155689.52, "actual": 1638003887.03},
    "surplus": {"original": 46342765.53, "final": 71511111.25, "actual": 930569028.37}
  },
  "revenue": [
    { "category": "Local Sources", "group": "Tax Revenue", "item": "Tax Revenue - Property", "original": 108650000, "final": 108650000, "actual": 107044742.14 },
    { "category": "Local Sources", "group": "Tax Revenue", "item": "Tax Revenue - Goods and Services", "original": 197439494, "final": 197439494, "actual": 230501262.98 },
    { "category": "Local Sources", "group": "Non-Tax Revenue", "item": "Service Income", "original": 61137957.5, "final": 61476542.5, "actual": 54008621.24 },
    { "category": "Local Sources", "group": "Non-Tax Revenue", "item": "Business Income", "original": 98150216.84, "final": 98150216.84, "actual": 79323255.95 },
    { "category": "Local Sources", "group": "Non-Tax Revenue", "item": "Other Income and Receipts", "original": 750127959.17, "final": 809240722.42, "actual": 809141259.9 },
    { "category": "External Sources", "item": "Share from the National Internal Revenue Taxes (IRA)", "original": 1067605124, "final": 1067605124, "actual": 1063987170 },
    { "category": "External Sources", "group": "Share from GOCCs", "item": "Share from PCSO", "original": 1300000, "final": 1300000, "actual": 1179077.12 },
    { "category": "External Sources", "group": "Other Shares from National Tax Collections", "item": "Share from Ecozone", "original": 0, "final": 0, "actual": 38599 },
    { "category": "External Sources", "group": "Other Receipts", "item": "Other Subsidy Income", "original": 0, "final": 38046101.01, "actual": 35590327.07 },
    { "category": "Receipts from Borrowings", "item": "Receipts from Borrowings", "original": 0, "final": 187758600, "actual": 187758600 }
  ],
  "expenditures": [
    { "appropriation": "current", "sector": "General Public Services", "item": "Personnel Services", "original": 330185091.29, "final": 319601644.32, "actual": 264793871.22 },
    { "appropriation": "current", "sector": "General Public Services", "item": "Maintenance and Other Operating Expenses", "original": 283787400.09, "final": 324406363.51, "actual": 259477093.01 },
    { "appropriation": "current", "sector": "General Public Services", "item": "Capital Outlay", "original": 850000, "final": 25139280.75, "actual": 924208.28 },
    { "appropriation": "current", "sector": "Education", "item": "Personnel Services", "original": 12810000, "final": 13410000, "actual": 13104309.16 },
    { "appropriation": "current", "sector": "Education", "item": "Maintenance and Other Operating Expenses", "original": 18010000, "final": 18965383.6, "actual": 11391768.07 },
    { "appropriation": "current", "sector": "Education", "item": "Capital Outlay", "original": 23000000, "final": 46446700, "actual": 27277804.74 },
    { "appropriation": "current", "sector": "Health, Nutrition and Population Control", "item": "Personnel Services", "original": 67772569.44, "final": 67935928.62, "actual": 65052754.56 },
    { "appropriation": "current", "sector": "Health, Nutrition and Population Control", "item": "Maintenance and Other Operating Expenses", "original": 45068113.85, "final": 45730814.17, "actual": 34787487.3 },
    { "appropriation": "current", "sector": "Health, Nutrition and Population Control", "item": "Capital Outlay", "original": 0, "final": 145485, "actual": 127893 },
    { "appropriation": "current", "sector": "Social Services and Social Welfare", "item": "Personnel Services", "original": 22018249.08, "final": 21540650.56, "actual": 16395051.44 },
    { "appropriation": "current", "sector": "Social Services and Social Welfare", "item": "Maintenance and Other Operating Expenses", "original": 40411006.03, "final": 45319486, "actual": 31991500.23 },
    { "appropriation": "current", "sector": "Social Services and Social Welfare", "item": "Capital Outlay", "original": 0, "final": 277000, "actual": 0 },
    { "appropriation": "current", "sector": "Economic Services", "item": "Personnel Services", "original": 93184083.8, "final": 91174258.15, "actual": 76277816.72 },
    { "appropriation": "current", "sector": "Economic Services", "item": "Maintenance and Other Operating Expenses", "original": 163968114.12, "final": 185605874.05, "actual": 142982135.11 },
    { "appropriation": "current", "sector": "Economic Services", "item": "Capital Outlay", "original": 3000000, "final": 30627233.04, "actual": 894011.84 },
    { "appropriation": "current", "sector": "Other Purposes", "group": "Debt Service", "item": "Financial Expense", "original": 88599644.34, "final": 115843688.4, "actual": 39931714.57 },
    { "appropriation": "current", "sector": "Other Purposes", "group": "Debt Service", "item": "Amortization", "original": 0, "final": 0, "actual": 62660999.38 },
    { "appropriation": "current", "sector": "Other Purposes", "group": "LDRRMF", "item": "Maintenance and Other Operating Expenses", "original": 39115000, "final": 39317800, "actual": 36056716 },
    { "appropriation": "current", "sector": "Other Purposes", "group": "LDRRMF", "item": "Capital Outlay", "original": 29885000, "final": 39574210, "actual": 6879407.44 },
    { "appropriation": "current", "sector": "Other Purposes", "group": "20% Development Fund", "item": "Capital Outlay", "original": 214000000, "final": 304382046, "actual": 72548466.92 },
    { "appropriation": "current", "sector": "Other Purposes", "group": "Others", "item": "Aid to Barangays", "original": 2800000, "final": 2800000, "actual": 2550200 },
    { "appropriation": "current", "sector": "Other Purposes", "group": "Others", "item": "Confidential Fund", "original": 0, "final": 6344833.73, "actual": 6344833.73 },
    { "appropriation": "current", "sector": "Other Purposes", "group": "Others", "item": "2% Discretionary Fund", "original": 703528.73, "final": 703528.73, "actual": 703528.72 },
    { "appropriation": "current", "sector": "Other Purposes", "group": "Others", "item": "Miscellaneous Personnel Benefits Fund (MPBF)", "original": 4778000, "final": 75291128.09, "actual": 71314464.42 },
    { "appropriation": "current", "sector": "Other Purposes", "group": "Others", "item": "Subsidy to Economic Enterprise/Special Accounts", "original": 4844226.04, "final": 35590327.05, "actual": 35590327.07 },
    { "appropriation": "continuing", "sector": "General Public Services", "item": "Capital Outlay", "original": 13730493.27, "final": 15548656.52, "actual": 2119982 },
    { "appropriation": "continuing", "sector": "Education", "item": "Capital Outlay", "original": 25441488.41, "final": 23819404.81, "actual": 13795620.29 },
    { "appropriation": "continuing", "sector": "Health, Nutrition and Population Control", "item": "Capital Outlay", "original": 630600, "final": 630600, "actual": 405000 },
    { "appropriation": "continuing", "sector": "Economic Services", "item": "Capital Outlay", "original": 473194288.57, "final": 459594288.57, "actual": 248628786.05 },
    { "appropriation": "continuing", "sector": "Other Purposes", "item": "Capital Outlay", "original": 236281088.92, "final": 142389075.85, "actual": 92996135.76 }
  ]
}
